{
  "$schema": "./personal-site-template-contract.schema.json",
  "contract_id": "garden-index-template-v1",
  "version": 1,
  "status": "implemented",
  "template": {
    "id": "garden-index",
    "name": "Garden Index",
    "candidate_id": "garden-index",
    "reusable_market": "Personal PR base for individuals, operators, makers, small studios, and small businesses."
  },
  "positioning": {
    "first_impression": "A personal root with a clear path into deeper public notes.",
    "curiosity_strategy": "Feature the docs route as the deeper room while keeping the root direct.",
    "tone": [
      "normal",
      "direct",
      "personal",
      "trustworthy"
    ],
    "must_feel_like": [
      "a real person with taste",
      "a maintained public front door",
      "easy to act on"
    ],
    "must_not_feel_like": [
      "pitch deck",
      "tech stack personality",
      "generic SaaS hero",
      "overexplained portfolio"
    ]
  },
  "audience_modes": [
    {
      "id": "professional-reviewer",
      "intent": "Check work, resume, docs, and GitHub quickly.",
      "primary_exits": [
        "Resume",
        "Docs",
        "GitHub"
      ]
    },
    {
      "id": "social-discovery",
      "intent": "Get a curated glimpse of the person and choose a social/contact path.",
      "primary_exits": [
        "LinkedIn",
        "Bluesky",
        "Instagram",
        "Signal"
      ]
    },
    {
      "id": "direct-contact",
      "intent": "Find the right way to contact or schedule.",
      "primary_exits": [
        "Schedule",
        "Email",
        "Signal"
      ]
    }
  ],
  "reference_set": [
    {
      "id": "maggie-appleton",
      "url": "https://maggieappleton.com/",
      "role": "Digital garden and visual note reference",
      "borrow": [
        "direct structure",
        "strong signal without overexplaining"
      ],
      "avoid": [
        "copying visual identity",
        "making the page feel like a generic template"
      ]
    },
    {
      "id": "tania-rascia",
      "url": "https://www.taniarascia.com/",
      "role": "Readable developer writing reference",
      "borrow": [
        "direct structure",
        "strong signal without overexplaining"
      ],
      "avoid": [
        "copying visual identity",
        "making the page feel like a generic template"
      ]
    }
  ],
  "content_contract": {
    "shared_source": "src/data/site.json",
    "required_modules": [
      "identity",
      "work",
      "contact",
      "social"
    ],
    "optional_modules": [
      "garden",
      "lifestyle",
      "proof_grid",
      "offers"
    ],
    "copy_rules": [
      "Use plain nouns and direct action labels.",
      "Do not add pitch copy to compensate for weak structure.",
      "Route labels and URLs are content-contract invariants."
    ]
  },
  "experience_contract": {
    "mobile_first": true,
    "first_screen": "A personal root with a clear path into deeper public notes.",
    "navigation_model": "Shared route content rendered as template-owned navigation objects.",
    "progressive_disclosure": "The root shows enough to invite action and leaves deeper explanation to linked surfaces.",
    "interaction_requirements": [
      "All links are tappable on mobile.",
      "Keyboard focus is visible.",
      "No route depends on hover-only meaning."
    ]
  },
  "visual_contract": {
    "layout": [
      "two-part hero with docs feature card",
      "three-column route grid on desktop and single-column mobile"
    ],
    "typography": [
      "Display: Georgia, serif",
      "Body: -apple-system, BlinkMacSystemFont, 'Segoe UI', system-ui, sans-serif",
      "No negative letter spacing."
    ],
    "color": [
      "Page: #F4F2EA",
      "Surface: #FFFDF7",
      "Accent: #315F4A"
    ],
    "texture": [
      "Use surface, spacing, and line quality instead of decorative effects."
    ],
    "density": [
      "Mobile-first density",
      "Below-fold hint preferred",
      "Readable tap rhythm"
    ]
  },
  "motion_contract": {
    "policy": "Motion may guide attention, never carry meaning.",
    "allowed": [
      "subtle hover background on route rows",
      "no motion required for comprehension"
    ],
    "forbidden": [
      "motion required for comprehension",
      "large decorative animation",
      "scroll-jacking"
    ]
  },
  "privacy_contract": {
    "invariants": [
      "privacy behavior unchanged",
      "analytics behavior unchanged",
      "direct link behavior unchanged",
      "shared content ownership unchanged"
    ],
    "review_required_for": [
      "new provider calls",
      "embedded social feeds",
      "private photos or locations",
      "new analytics collection"
    ]
  },
  "implementation_scope": {
    "build_status": "Implemented as a governed template preview.",
    "intended_files": [
      "src/design-templates/garden-index/manifest.yaml",
      "src/design-templates/garden-index/index.astro",
      "src/design-templates/garden-index/styles.css",
      "src/design-templates/garden-index/control-map.json",
      "src/lib/design-template-ids.ts",
      "src/lib/design-template-registry.ts",
      "src/design-templates/candidate-templates.json"
    ],
    "preview_route": "/preview/garden-index",
    "activation_rule": "Only activate after mobile and desktop screenshot comparison beats the current active template for its intended question."
  },
  "qa_gates": [
    "npm_build",
    "route_health_check",
    "mobile_screenshot",
    "desktop_screenshot",
    "no_text_overflow",
    "keyboard_focus_visible",
    "contrast_readable",
    "privacy_behavior_unchanged",
    "template_can_be_previewed_without_activation"
  ],
  "selection_criteria": [
    "Keeps shared route content stable.",
    "Improves the template-specific design question.",
    "Feels personal and credible without overexplaining."
  ]
}
